{
  "code": "KY",
  "name": "Kentucky",
  "filing": {
    "name": "Kentucky Secretary of State",
    "url": "https://www.sos.ky.gov/bus/business-filings"
  },
  "revenue": {
    "name": "Kentucky Department of Revenue",
    "url": "https://revenue.ky.gov"
  },
  "labor": {
    "name": "Kentucky Office of Unemployment Insurance",
    "url": "https://kcc.ky.gov"
  },
  "workersComp": {
    "agency": "Kentucky Department of Workers' Claims",
    "threshold": "1 employee",
    "trigger": {
      "minEmployees": 1
    },
    "stateFund": false
  },
  "llcReport": {
    "frequency": "annual",
    "fee": "$15",
    "deadline": "June 30",
    "due": {
      "type": "fixed",
      "month": 6,
      "day": 30
    },
    "feeDetail": {
      "basis": "flat",
      "amount": 15
    }
  },
  "corpReport": {
    "frequency": "annual",
    "fee": "$15",
    "deadline": "June 30",
    "due": {
      "type": "fixed",
      "month": 6,
      "day": 30
    },
    "feeDetail": {
      "basis": "flat",
      "amount": 15
    }
  },
  "entityTax": "Corporation income tax and Limited Liability Entity Tax (LLET)",
  "wageWithholding": true,
  "salesTax": {
    "statewide": true,
    "permit": "Kentucky sales and use tax permit",
    "agency": null,
    "alternative": null
  },
  "local": {
    "title": "City/county occupational license",
    "authority": "City or county occupational tax office",
    "description": "Local governments levy occupational license taxes on net profits and payroll."
  },
  "paidLeave": null,
  "paidSickLeave": null,
  "businessLicense": null,
  "llcPublication": null,
  "economicNexusUsd": 100000,
  "dbaFiling": "county",
  "industry": {
    "contractor": null,
    "realEstate": "Kentucky Real Estate Commission",
    "alcohol": "Kentucky Department of Alcoholic Beverage Control",
    "childCare": "Kentucky Cabinet for Health and Family Services",
    "health": "Kentucky Office of Inspector General"
  },
  "verification": {
    "checkedOn": "2026-10-13",
    "scope": "Entity annual/biennial report fee and deadline, workers' comp coverage thresholds (states not listed under unconfirmed), and DBA filing level were checked against web search results on 2026-10-13, primarily official state pages where available; other fields are compiled from public knowledge and not individually checked.",
    "sources": ["https://www.sos.ky.gov/bus/business-filings/Pages/Annual-Reports.aspx"],
    "unconfirmed": [],
    "dba": "checked"
  },
  "dbaOffice": "County clerk",
  "cannabis": {
    "status": "medical_only",
    "regulator": "Kentucky Office of Medical Cannabis (Cabinet for Health and Family Services)"
  },
  "localSalesTax": "none"
}
