{
  "code": "MO",
  "name": "Missouri",
  "filing": {
    "name": "Missouri Secretary of State",
    "url": "https://www.sos.mo.gov/business"
  },
  "revenue": {
    "name": "Missouri Department of Revenue",
    "url": "https://dor.mo.gov"
  },
  "labor": {
    "name": "Missouri Division of Employment Security",
    "url": "https://labor.mo.gov/DES"
  },
  "workersComp": {
    "agency": "Missouri Division of Workers' Compensation",
    "threshold": "5 employees (1 in construction)",
    "trigger": {
      "minEmployees": 5,
      "constructionMinEmployees": 1
    },
    "stateFund": false
  },
  "llcReport": null,
  "corpReport": {
    "frequency": "annual",
    "fee": "$20 online ($45 paper)",
    "deadline": "End of the month of incorporation or qualification",
    "title": "File Annual Registration Report",
    "due": {
      "type": "anniversary",
      "point": "end_of_month"
    },
    "feeDetail": {
      "basis": "flat",
      "amount": 20,
      "online": 20,
      "paper": 45
    }
  },
  "entityTax": "Corporate income tax",
  "wageWithholding": true,
  "salesTax": {
    "statewide": true,
    "permit": "Missouri sales tax license",
    "agency": null,
    "alternative": null
  },
  "local": {
    "title": "City business license",
    "authority": "City collector / county",
    "description": "Kansas City, St. Louis and many cities require business licenses and occupational taxes."
  },
  "paidLeave": null,
  "paidSickLeave": null,
  "businessLicense": null,
  "llcPublication": null,
  "economicNexusUsd": 100000,
  "dbaFiling": "state",
  "industry": {
    "contractor": null,
    "realEstate": "Missouri Real Estate Commission",
    "alcohol": "Missouri Division of Alcohol and Tobacco Control",
    "childCare": "Missouri Department of Health and Senior Services",
    "health": "Missouri Department of Health and Senior Services"
  },
  "verification": {
    "checkedOn": "2026-10-13",
    "scope": "Entity annual/biennial report fee and deadline, workers' comp coverage thresholds (states not listed under unconfirmed), and DBA filing level were checked against web search results on 2026-10-13, primarily official state pages where available; other fields are compiled from public knowledge and not individually checked.",
    "sources": ["https://www.sos.mo.gov/business/faqs"],
    "unconfirmed": [],
    "dba": "checked"
  },
  "lpReport": null,
  "llpReport": {
    "frequency": "annual",
    "fee": "$105 plus $50 for each partner added (maximum $205)",
    "deadline": "Anniversary of registration",
    "title": "Renew LLP registration",
    "due": {
      "type": "anniversary",
      "point": "date"
    },
    "feeDetail": {
      "basis": "per_partner",
      "amount": 105,
      "perUnit": 50,
      "max": 205,
      "note": "per partner added"
    }
  },
  "cannabis": {
    "status": "adult_use",
    "regulator": "Missouri Department of Health and Senior Services, Division of Cannabis Regulation"
  },
  "localSalesTax": "state_administered"
}
