{
  "code": "OK",
  "name": "Oklahoma",
  "filing": {
    "name": "Oklahoma Secretary of State",
    "url": "https://www.sos.ok.gov"
  },
  "revenue": {
    "name": "Oklahoma Tax Commission",
    "url": "https://oklahoma.gov/tax"
  },
  "labor": {
    "name": "Oklahoma Employment Security Commission",
    "url": "https://oklahoma.gov/oesc"
  },
  "workersComp": {
    "agency": "Oklahoma Workers' Compensation Commission",
    "threshold": "1 employee",
    "trigger": {
      "minEmployees": 1
    },
    "stateFund": false
  },
  "llcReport": null,
  "corpReport": null,
  "entityTax": "Corporate income tax",
  "wageWithholding": true,
  "salesTax": {
    "statewide": true,
    "permit": "Oklahoma sales tax permit",
    "agency": null,
    "alternative": null
  },
  "local": {
    "title": "City business license",
    "authority": "City clerk",
    "description": "Some Oklahoma cities require business licenses and local sales tax registration."
  },
  "paidLeave": null,
  "paidSickLeave": null,
  "businessLicense": null,
  "llcPublication": null,
  "economicNexusUsd": 100000,
  "dbaFiling": "state",
  "industry": {
    "contractor": "Oklahoma Construction Industries Board (trade licenses)",
    "realEstate": "Oklahoma Real Estate Commission",
    "alcohol": "Oklahoma Alcoholic Beverage Laws Enforcement Commission",
    "childCare": "Oklahoma Department of Human Services",
    "health": "Oklahoma State Department of Health"
  },
  "verification": {
    "checkedOn": "2026-10-13",
    "scope": "Entity annual/biennial report fee and deadline, workers' comp coverage thresholds (states not listed under unconfirmed), and DBA filing level were checked against web search results on 2026-10-13, primarily official state pages where available; other fields are compiled from public knowledge and not individually checked.",
    "sources": ["https://www.sos.ok.gov/business/fees.aspx"],
    "unconfirmed": [],
    "dba": "checked"
  },
  "lpReport": {
    "frequency": "annual",
    "fee": "$50",
    "deadline": "On the anniversary of registration",
    "title": "File Annual Certificate",
    "due": {
      "type": "anniversary",
      "point": "date"
    }
  },
  "cannabis": {
    "status": "medical_only",
    "regulator": "Oklahoma Medical Marijuana Authority"
  },
  "localSalesTax": "state_administered",
  "llpReport": null
}
