{
  "code": "VA",
  "name": "Virginia",
  "filing": {
    "name": "Virginia State Corporation Commission",
    "url": "https://www.scc.virginia.gov/pages/Business-Entities"
  },
  "revenue": {
    "name": "Virginia Department of Taxation",
    "url": "https://www.tax.virginia.gov"
  },
  "labor": {
    "name": "Virginia Employment Commission",
    "url": "https://www.vec.virginia.gov"
  },
  "workersComp": {
    "agency": "Virginia Workers' Compensation Commission",
    "threshold": "3 employees (more than 2 regularly employed)",
    "trigger": {
      "minEmployees": 3
    },
    "stateFund": false
  },
  "llcReport": {
    "frequency": "annual",
    "fee": "$50",
    "deadline": "Last day of the anniversary month",
    "title": "Pay Annual Registration Fee",
    "due": {
      "type": "anniversary",
      "point": "end_of_month"
    }
  },
  "corpReport": {
    "frequency": "annual",
    "fee": "$100 (up to 5,000 authorized shares; scales above)",
    "deadline": "Last day of the anniversary month",
    "title": "Pay Annual Registration Fee",
    "due": {
      "type": "anniversary",
      "point": "end_of_month"
    }
  },
  "entityTax": "Corporate income tax",
  "wageWithholding": true,
  "salesTax": {
    "statewide": true,
    "permit": "Virginia Certificate of Registration (sales and use tax)",
    "agency": null,
    "alternative": null
  },
  "local": {
    "title": "City/county BPOL license",
    "authority": "Local commissioner of revenue",
    "description": "Virginia localities require a Business, Professional and Occupational License (BPOL)."
  },
  "paidLeave": null,
  "paidSickLeave": null,
  "businessLicense": null,
  "llcPublication": null,
  "economicNexusUsd": 100000,
  "dbaFiling": "state",
  "industry": {
    "contractor": "Virginia Board for Contractors (DPOR)",
    "realEstate": "Virginia Real Estate Board (DPOR)",
    "alcohol": "Virginia Alcoholic Beverage Control Authority",
    "childCare": "Virginia Department of Education, Office of Early Childhood",
    "health": "Virginia Department of Health"
  },
  "verification": {
    "checkedOn": "2026-10-13",
    "scope": "Entity annual/biennial report fee and deadline, workers' comp coverage thresholds (states not listed under unconfirmed), and DBA filing level were checked against web search results on 2026-10-13, primarily official state pages where available; other fields are compiled from public knowledge and not individually checked.",
    "sources": ["https://www.scc.virginia.gov/businesses/business-faqs/annual-registration-fees/"],
    "unconfirmed": [],
    "dba": "checked"
  },
  "llpReport": {
    "frequency": "annual",
    "fee": "$50",
    "deadline": "July 1",
    "title": "File annual continuation report",
    "due": {
      "type": "fixed",
      "month": 7,
      "day": 1
    }
  },
  "lpReport": {
    "frequency": "annual",
    "fee": "$50",
    "deadline": "October 1",
    "title": "Pay annual registration fee",
    "due": {
      "type": "fixed",
      "month": 10,
      "day": 1
    }
  },
  "cannabis": {
    "status": "medical_only",
    "regulator": "Virginia Cannabis Control Authority",
    "note": "Adult-use retail sales are slated to begin July 1, 2027; only the medical program is licensed for sales today."
  },
  "localSalesTax": "state_administered"
}
